p_id,Name,Brand,Price,DiscountedPrice,Category,SubCategory,Quantity,Description,BreadCrumbs
dmart1,"Premia Badam (Almonds)",Premia,451,329,Grocery,"Grocery/Dry Fruits","500 gm",India,"Grocery > Grocery/Dry Fruits"
dmart10,"Premia Mamra Badam",Premia,634,488,Grocery,"Dry Fruits","200 gm",India,"Grocery > Dry Fruits"
dmart100,"Organic Tattva Kala Chana","Organic Tattva",85,59,Grocery,Pulses,"500 gm","OverviewOrganic Tattva's Organic Kala Chana is full of iron, calcium, and protein. Along with these nutrients, a bowl of Organic Kala Chana also contains dietary fibers, vitamins, and all the other nutrients that are required for your body. A 100g serving of Organic Kala Chana contains 0g trans fat and 0mg cholesterol. The calorie count per serving of Organic Kala Chana is 351.68. If leading a healthy life is your mantra, then switch to Organic Kala Chana by Organic Tattva today!Key Features- 100% vegan- Gluten free- No additives- Organically grown without pesticides and fertilizers- Certified organicBenefitsKala Chana or Black Gram is famous for its high iron content which makes it a favorable food for menstruating, pregnant, or lactating women and growing children. So, Organic Tattva ensures their produce is grown in conditions that retain high quantities of iron and absolutely no addition of colours.Care InstructionsStore in a cool & dry place.About the BrandSince 1969, Mehrotra Impex (India), has been a manufacturer and exporter of handicrafts, household, kitchenware, and decorative items. In 2012, the company ventured into the Organic food Business with their domestic brand, Organic Tattva, of everyday grocery items for the Indian household. They are one of the leaders in the organic food industry, solely dedicated to providing the highest quality products, right from the field all the way to your kitchen.","Grocery > Pulses"
dmart1000,"Twinings Green Tea Lemon & Honey",Twinings,299,254,"Packaged Food","Gourmet Food","25 Bags","Key Features- A Classic Twist: Sweetness of honey with the tanginess of lemon, some flavours are simply made for each other. They decided to give a twist to the classic fusion of black tea with honey and lemon and brought a blend of green tea with lemon and honey.- Delicious & Soothing: A dash of lemon, carefully contrasted with the natural sweetness of honey, lends this delicate blend a delicious and soothing flavour.  Benefits: Pure green tea has less than one calorie and is a good source of hydration. Green teas are generally lower in caffeine than black teas. The Chinese believe that Green Teas can aid digestion.  How To Make The Perfect Green Tea Lemon & Honey: Boil some water and let it cool down a bit. Then pour the water into a cup and add a teabag. Let it brew for a max of 2 minutes or you may lose the delicate taste. Take a sip and let it revitalise you.  About the Brand The legacy of collecting the best tea from select tea gardens throughout the world got Twinings Royal Warrant by Queen Victoria for making tea for the British Monarchs. Your perfect tea break&ndash; generations in the making.","Packaged Food > Gourmet Food"
dmart1001,"Twinings Green Tea Lemon & Honey",Twinings,999,855,"Packaged Food","Gourmet Food","100 Bags","Key Features A Classic Twist: The rich sweetness of honey. The sharp tanginess of lemon. There are some flavours that are simply made for each other. People have been stirring honey and lemon into their black tea for generations. So They decided to give this old favourite a new twist by blending it with their delicate and golden green tea. Delicious & Soothing : A dash of lemon, carefully contrasted with the natural sweetness of honey, lends this delicate blend a delicious and soothing flavour.  Benefits: Pure green tea has less than one calorie and is a good source of hydration. Green teas are generally lower in caffeine than black teas. The Chinese believe that Green Teas can aid digestion.  How To Make The Perfect Green Tea Lemon & Honey: Boil some water, but let it cool slightly before pouring. Add a teabag to the cup of hot water and allow to brew for a maximum of 2 minutes, any longer and you may lose the delicate taste. Take the first sip and let the whole cup revitalize your spirits.  About the Brand Twinings teas have been an ideal choice of the Royal Households for more than 150 years. Twinings family members carry the legacy of expertise and passion from one generation to the next. All their master blenders have a minimum of 15 years of experience. Your perfect tea break, 300 years in making.","Packaged Food > Gourmet Food"
dmart1002,"Tea Culture Of The World Tulsi Ritual Exotic Tea","Tea Culture Of The World",249,175,"Dairy & Beverages",Beverages,"20 Bag","Key Features- The Infusion : Fresh and Herbal- Aroma: Herbal - Appearance: Pale Green - Taste: Mild and HerbalHow to UseTear open the sachet, steep the tea bag in hot water (80&deg;C) for 3 minutes and sip it up. You can add honey or sugar for sweetness as required.Benefits Tulsi green tea helps in weight loss, enhances stamina, and invigorates &ndash; a host of health benefits in a teacup.Care InstructionsStore in room temperature, Do not keep under sunlight.About the BrandThey started the journey in 2010 and today Tea Culture Of The World delights tea connoisseurs across India and the world with its signature blends of over 80 exquisite herbal and flavoured teas. Each is an experience unto itself.To make handcrafted whole leaf teas they started by first handpicking the tea estates. They plucked from places as far and wide as Japan, China, Vietnam, South Africa, Argentina, and of course, India. Fruits and herbs, from Europe. Flowers, from Egypt.When each blend is an invitation from the Founder to indulge in an experience that will linger for long, nothing less will do.","Dairy & Beverages > Beverages"
dmart1003,"Twinings Darjeeling Loose Leaf Tea",Twinings,750,601,"Packaged Food","Gourmet Food","100 gm","Key Features Darjeeling's Finest Teas: The Darjeeling region in north eastern India is a magical place. Nestled in the Himalayan foothills against the backdrop of Mt. Kanchenjunga, one of the highest peaks in the world, its distinctive tea plantations can be reached by the Himalayan Railway. People will travel far and wide for the exquisite teas produced in the Darjeeling tea gardens. The tea, from the foothills of Himalayas, is considered as the champagne of all teas. Rejuvenate Body & Mind: One whiff of this select blend of un-oxidized leaves and your senses will embark on a journey. A green tea that looks clear with a beautiful golden-yellow hue. Each sip brings with it the mystical and enchanting taste of Darjeeling. Not to mention, it will leave your mind and body fully rejuvenated  How To Make The Perfect Darjeeling Green Whole Leaf Tea: use 1 rounded teaspoon per person. Boil some water, but let it cool slightly before pouring. Allow the flavours to infuse for 3 minutes. You don&rsquo;t need to add anything for the perfect flavour.About The Brand Generations of the Twinings family have carried a legacy of passion in the crafting of tea. Queen Victoria granted Twinings its first Royal Warrant and our have had the honour of making tea for every British Monarch ever since. our master blenders travel the globe in search of the finest, rarest and most exciting teas. Your perfect tea-break &ndash; ten generations in the making.","Packaged Food > Gourmet Food"
dmart1004,"Twinings Green Tea & Lemon",Twinings,955,820,"Packaged Food","Gourmet Food","100 Bags","Key Features Cool & Refreshing: An earthy blend which, when combined with mint leaves and natural mint flavour, transforms into a refreshing, cooling combination, a perfect lift for any time of day. Feel Revitalised: Their green tea fused with the mint flavour makes every sip of this drink revitalizing. They choose our first and second flush green teas from the select tea gardens in China during spring, when the best teas leaves are in season.  Benefits: Pure green tea has less than one calorie and is a good source of hydration. Green teas are generally lower in caffeine than black teas. The Chinese believe that Green Teas can aid digestion.  How To Make The Perfect Green Tea & Mint: Boil some water and let it cool down a bit. Then pour the water into a cup and add a teabag. Let it brew for a max of 2 minutes or you may lose the delicate taste. Take a sip and let it revitalise you.  About The Brand The legacy of collecting the best tea from select tea gardens throughout the world got Twinings Royal Warrant by Queen Victoria for making tea for the British Monarchs. Your perfect tea break&ndash; generations in the making.","Packaged Food > Gourmet Food"
dmart1005,"Tea Culture Of The World Soothing Chamomile Exotic Tea","Tea Culture Of The World",299,210,"Dairy & Beverages",Beverages,"20 Bag","Key Features- The Infusion : Mild and Herbal - The Aroma: Fresh and Herbal- Appearance: Pale Green- Taste: Fresh, Mild and HerbalHow to UseTear Open the sachet, Steep the tea bag in hot water (80&deg;C) for 3 minutes and sip it up. You can add honey or sugar for sweetness as required.Benefits 1. Chamomile is known to aid restful sleep and may also relieve stress and anxiety.2. Antioxidants in green tea may protect against chronic diseases such as cancer and heart diseases.Care InstructionsStore in room temperature, Do not keep under sunlight.About the BrandThey started the journey in 2010 and today Tea Culture Of The World delights tea connoisseurs across India and the world with its signature blends of over 80 exquisite herbal and flavoured teas. Each is an experience unto itself.To make handcrafted whole leaf teas they started by first handpicking the tea estates. They plucked from places as far and wide as Japan, China, Vietnam, South Africa, Argentina, and of course, India. Fruits and herbs, from Europe. Flowers, from Egypt.When each blend is an invitation from the Founder to indulge in an experience that will linger for long, nothing less will do.","Dairy & Beverages > Beverages"
dmart1006,"Britannia Diced Pizza Cheese Blend",Britannia,150,125,"Dairy & Beverages",Dairy,"200 gm","Overview- Britannia Diced Pizza Cheese Blend brings to you a perfect blend of mozzarella cheese and cheddar cheese- This diced cheese is commonly used in starters and sides- Mozzarella is the most popular cheese option for a pizza and the cheddar cheese blends well with it- It is packed with calcium and minerals that are essential for the body- It has the most important nutrients for promoting bone health- It is perfect for any pizza making it flavourful and oh so gooey.Key Features- Used in a wide range of dishes- Rich in proteins, calcium and minerals.How to Use- This diced cheese is amazing for pizzas- It can also be used in sandwiches and toasts at home- Cut it into small cheesy chunks, melt it for a perfect cheese pull or grate it as a topping.IngredientsMozzarella Cheese- 70% (Milk Solids, Iodised Salt, Active Cultures & Microbial Enzyme) And Cheddar Cheese- 30% (Milk Solids, Iodised Salt, Active Cultures & Microbial Enzyme)Care Instructions- When stored refrigerated, it can be enjoyed for as long as nine months.","Dairy & Beverages > Dairy"
dmart1007,"Britannia Diced Pizza Cheese Blend",Britannia,350,295,"Dairy & Beverages",Dairy,"500 gm","Overview- Britannia Diced Pizza Cheese Blend brings to you a perfect blend of mozzarella cheese and cheddar cheese- This diced cheese is commonly used in starters and sides- Mozzarella is the most popular cheese option for a pizza and the cheddar cheese blends well with it- It is packed with calcium and minerals that are essential for the body- It has the most important nutrients for promoting bone health- It is perfect for any pizza making it flavourful and oh so gooey.Key Features- Used in a wide range of dishes- Rich in proteins, calcium and minerals.How to Use- This diced cheese is amazing for pizzas- It can also be used in sandwiches and toasts at home- Cut it into small cheesy chunks, melt it for a perfect cheese pull or grate it as a topping.IngredientsMozzarella Cheese- 70% (Milk Solids, Iodised Salt, Active Cultures & Microbial Enzyme) And Cheddar Cheese- 30% (Milk Solids, Iodised Salt, Active Cultures & Microbial Enzyme)Care Instructions- When stored refrigerated, it can be enjoyed for as long as nine months.","Dairy & Beverages > Dairy"
dmart1008,"Bru Instant Coffee Pouch",Bru,90,83,"Dairy & Beverages",Beverages,"50 gm","
Made from a fine blend of choicest plantations and robust beans, BRU Instant coffee offers a rich coffee taste. Our strong processes ensure that the fresh coffee aroma is preserved so that you get the best coffee experience, instantly. Who needs a coffee machine!
","Dairy & Beverages > Beverages"
dmart1009,"Tea Culture Of The World Moroccan Mint Exotic Tea","Tea Culture Of The World",249,175,"Dairy & Beverages",Beverages,"20 Bag","Key Features- The Infusion : Smooth and Minty- Aroma: Fresh and Minty - Appearance: Vibrant Green- Taste: Refreshing and subtly sweet.How to UseTear open the sachet, steep the tea bag in hot water (80&deg;C) for 3 minutes and sip it up. You can add honey or sugar for sweetness as required.Benefits 1. May help relieve heartburn and stomach ailments.2. Antioxidants in peppermint may promote healthy skin.3. Antioxidants in green tea may protect against chronic diseases such as cancer and heart diseases.Care InstructionsStore in room temperature, Do not keep under sunlight.About the BrandThey started the journey in 2010 and today Tea Culture Of The World delights tea connoisseurs across India and the world with its signature blends of over 80 exquisite herbal and flavoured teas. Each is an experience unto itself.To make handcrafted whole leaf teas they started by first handpicking the tea estates. They plucked from places as far and wide as Japan, China, Vietnam, South Africa, Argentina, and of course, India. Fruits and herbs, from Europe. Flowers, from Egypt.When each blend is an invitation from the Founder to indulge in an experience that will linger for long, nothing less will do.","Dairy & Beverages > Beverages"
dmart101,"Kokan Gem Goa Cashew Premium (Kaju)","Kokan Gem",750,579,Grocery,"Dry Fruits","500 gm","OverviewKonkan Gem processes cashew seed only from Goa and the border of Goa and Konkan. These cashews are great in taste and are known to be one of the best in the world.IngredientsCashewsOther must know InformationBest before Nine months from packaging.","Grocery > Dry Fruits"
dmart1010,"Bru Instant Coffee Pouch",Bru,380,299,"Dairy & Beverages",Beverages,"200 gm","
Made from a fine blend of choicest plantations and robust beans, BRU Instant coffee offers a rich coffee taste. Our strong processes ensure that the fresh coffee aroma is preserved so that you get the best coffee experience, instantly. Who needs a coffee machine!
","Dairy & Beverages > Beverages"
dmart1011,"Twinings Pure Green Tea",Twinings,999,820,"Packaged Food","Gourmet Food","100 Bags","Key Features- A Soothing Blend: As dawn breaks and the dewy mist hangs in the air, fresh leaves are picked to lock in the pleasant green flavour. Handpicked from select gardens, their Pure Green Tea is a refreshing drink. You will surely enjoy this soothing blend.- Natural & Distinctive: An earthy blend that retains its natural, distinctive flavour. Once given as a precious gift in China, let this gentle tasting blend be a gift from them to you.  Benefits: Pure green tea has less than one calorie and is a good source of hydration. Green teas are generally lower in caffeine than black teas. The Chinese believe that Green Teas can aid digestion.  How To Make The Perfect Pure Green Tea: Boil some water and let it cool down a bit. Then pour the water in a cup and add a teabag. Let it brew for a max 2 minutes or you may lose the delicate taste. Take a sip and let it revitalise you.About the Brand The legacy of collecting the best tea from select tea gardens throughout the world got Twinings Royal Warrant by Queen Victoria for making tea for the British Monarchs. Your perfect tea break&ndash; generations in the making.","Packaged Food > Gourmet Food"
dmart1012,"Nescafé Classic Coffee",Nescafe,160,135,"Dairy & Beverages",Beverages,"50 gm","
100% pure natural coffee beans go into making every granule of Nescafé Classic. With the new world class ERA technology, you get richer aroma and an unmatched coffee experience to stimulate your senses every morning with your favourite Nescafé. The Coffee is 100% natural and contains antioxidants which helps in fighting free radicals.
So grab your favourite Nescafé Classic and kick start your day the Nescafé way!
","Dairy & Beverages > Beverages"
dmart1013,"Nescafé Classic Coffee",Nescafe,600,555,"Dairy & Beverages",Beverages,"200 gm","
100% pure natural coffee beans go into making every granule of Nescafé Classic. With the new world class ERA technology, you get richer aroma and an unmatched coffee experience to stimulate your senses every morning with your favourite Nescafé. The Coffee is 100% natural and contains antioxidants which helps in fighting free radicals.
So grab your favourite Nescafé Classic and kick start your day the Nescafé way!
","Dairy & Beverages > Beverages"
dmart1014,"D'lecta Cheese Slices",D'lecta,310,155,"Dairy & Beverages",Dairy,"400 gm","Key Features- 100% Cheddar Cheese Slices.- 100% Vegetarian.- Made from Cow's Milk.- Great ease and economy of usage- More cheese, less filler.- Fresh flavour, great taste.- Soft texture.How to UseCan be consumed directly, no cooking required. Remove outer wrapping before consumption.Any Other Must-Know InformationSource of Protein, Made from Cow Milk.Disclaimer If AnyContains Milk & Soya.BenefitsProcessed Cheese Slices, individually wrapped for economy and ease of use. Mild Cheddar can be used in burgers & sandwiches.Care InstructionsStore refrigerated 2-4 ᴼC, remove wrapper before consuming.About The BrandD&rsquo;lecta is one of India's fastest growing Cheese Brands. They specialize in premium cheeses like Cream cheese, Feta, Natural Cheddar, Mozzarella, and Melton. Their products are available in more than 1500 national modern trade chain stores, and more than 10000 GT retailers.","Dairy & Beverages > Dairy"
dmart1015,"Nescafé Classic Coffee",Nescafe,1320,1220,"Dairy & Beverages",Beverages,"500 gm","
100% pure natural coffee beans go into making every granule of Nescafé Classic. With the new world class ERA technology, you get richer aroma and an unmatched coffee experience to stimulate your senses every morning with your favourite Nescafé. The Coffee is 100% natural and contains antioxidants which helps in fighting free radicals.
So grab your favourite Nescafé Classic and kick start your day the Nescafé way!
","Dairy & Beverages > Beverages"
dmart1016,"Nestlé Everyday Dairy Whitener",Nestle,535,474,"Dairy & Beverages",Dairy,"1 kg","OverviewNestle Everyday is a dairy whitener also called dried milk powder that gives you a tastier and thicker cup of tea every time. Nestle Everyday is tea&rsquo;s best partner, it completely mixes into your tea that lifts your spirits and enlightens your day.Key Features- Tea-enhancing milk powder that completely dissolves in tea to enhance its flavour. - Get rich and delicious tea every time with Everyday Powder. - Comes with added sugar to make the perfect cup of tea.IngredientsMilk Solids, Sugar, Maltodextrin, and Stabilizer 339.How to UseAdd 1 tbsp. of Nestle Everyday to 100 ml of water and tea leaves for the perfect cup of tea.Storage InstructionsAfter opening, transfer the contents into an airtight container to avoid lumping. Store in a cool, dry and hygienic placeAbout the BrandNestle are the Good food, Good Life Company. They believe in the power of food to enhance lives. Good food nourishes and delights the senses. It helps children grow healthy, pets thrive, parents age gracefully and everyone lives life to the fullest. Good food brings us together. Good food also respects our planet and protects resources for future generations. At Nestl&eacute;, they constantly explore and push the boundaries of what is possible with foods, beverages, and nutritional health solutions to enhance the quality of life and contribute to a healthier future. They focus our energy and resources where unlocking the power of food can make the greatest difference to the lives of people and pets, protect and enhance the environment, and generate significant value for our shareholders and stakeholders alike.","Dairy & Beverages > Dairy"
dmart1017,"D'lecta Cheese Slices",D'lecta,160,99,"Dairy & Beverages",Dairy,"200 gm","Key Features- 100% Cheddar Cheese Slices.- 100% Vegetarian.- Made from Cow's Milk.- Great ease and economy of usage- More cheese, less filler.- Fresh flavour, great taste.- Soft texture.How to UseCan be consumed directly, no cooking required. Remove outer wrapping before consumption.Any Other Must-Know InformationSource of Protein, Made from Cow Milk.Disclaimer If AnyContains Milk & Soya.BenefitsProcessed Cheese Slices, individually wrapped for economy and ease of use. Mild Cheddar can be used in burgers & sandwiches.Care InstructionsStore refrigerated 2-4 ᴼC, remove wrapper before consuming.About The BrandD&rsquo;lecta is one of India's fastest growing Cheese Brands. They specialize in premium cheeses like Cream cheese, Feta, Natural Cheddar, Mozzarella, and Melton. Their products are available in more than 1500 national modern trade chain stores, and more than 10000 GT retailers.","Dairy & Beverages > Dairy"
dmart1018,"Gowardhan Paneer Classic Block",Gowardhan,98,83,"Dairy & Beverages",Dairy,"200 gm",India,"Dairy & Beverages > Dairy"
dmart1019,"Amul Diced Blend Cheese",Amul,495,455,"Dairy & Beverages",Dairy,"1 kg","   Page Title   Key FeaturesBlend of Diced Cheddar and Diced MozzarellaIngredientsFat: Minimum 21%Moisture: Maximum 50%Protein: Minimum 23%Added Salt: Maximum 2%Calorific Value: 291 Kcal./100gHow to UseBefore baking, sprinkle appropriate amount on pizza. The fine dices have a tangy flavour and may be used in a variety of recipes, including pizza, pasta, and nachos.Care InstructionsTo be stored frozen and thawed before use.Any Other Must-Know InformationIt's a combination of mozzarella and cheddar cheese. Amul has created a one-of-a-kind product. Simply sprinkle and savour the cheesy delights.About the BrandAmul was founded in 1946 to combat middlemen exploitation. The Amul model has helped India become the world's largest milk producer. Amul also manufactures cheese dahi, lassi, ice cream, and other dairy products. ","Dairy & Beverages > Dairy"
dmart102,"Tata Sampann Moong Chilka",TATA,84,75,Grocery,Dals,"500 gm","Overview:Packed with protein and low on carbs, green gram or moong dal is one of the best vegetarian superfoods. An integral part of the Indian diet, it is a good and filling option for those who want to shed kilos. Studies have shown that it helps protect you from skin cancer and skin pollution. A must eat for all the metro dwellers of India.Known to be one of the best natural sources of protein, Tata Sampann Moong Chilka is unpolished, i.e. it does not undergo any artifical polishing with water, oil or leather, thereby retaining its goodness and protein content.Key FeaturesAids in weight lossNaturally healthyProcessed in hygienic conditions5-step purity processStorage ConditionStore in a cool and dry place.","Grocery > Dals"
dmart1020,"Gowardhan Paneer Classic Block",Gowardhan,225,180,"Dairy & Beverages",Dairy,"500 gm",India,"Dairy & Beverages > Dairy"
dmart1021,"Gowardhan Go Cheese Slices - Plain","Gowardhan Go",155,120,"Dairy & Beverages",Dairy,"200 gm",India,"Dairy & Beverages > Dairy"
dmart1022,"Tetley Classic Immune Green Tea",Tetley,600,300,"Dairy & Beverages",Beverages,"100 Bags","
Tetley Green Tea with refreshing pure original flavour containing five times more antioxidants than fruit and vegetables, a cup of Tetley Natural Green Tea helps cleanse from within, from all those pollutants and toxins that our bodies are exposed to on a daily basis!! Rejuvenate yourself every day with a cup of Tetley Natural Green Tea. Bring fresh water to boil. Green tea is best made with water at 85*. Pour water into cup. Place one teabag and allow it to brew for about 2 mins. Remove the teabag. Sweeten with honey or sugar as desired. Green Tea is best had without milk.

*Actual packaging may vary from the Image

Note : Product in stock will be delivered basis availability
","Dairy & Beverages > Beverages"
dmart1023,"Le Café 100% Pure Instant Coffee","Le Cafe",108,54,"Dairy & Beverages",Beverages,"50 gm","OverviewLe Cafe Coffee is extracted from carefully selected Robusta & Arabica beans from the plantations of Tata Coffee. Each bean is carefully selected & roasted to perfection in the state of the art factories of Tata Coffee resulting in a great aroma & captivating coffee taste.IngredientsCoffee BeansStorage InstructionsStore in a Cool, Dry & Hygienic Place.","Dairy & Beverages > Beverages"
