p_id,Name,Brand,Price,DiscountedPrice,Category,SubCategory,Quantity,Description,BreadCrumbs
dmart1442,"Ensure Nutrition Powder - Vanilla Flavour",Ensure,615,555,"Dairy & Beverages",Beverages,"400 gm",India,"Dairy & Beverages > Beverages"
dmart1443,"Horlicks Classic Malt Jar",Horlicks,270,249,"Dairy & Beverages",Beverages,"500 gm","OverviewFilled with a wide range of vitamins and minerals, Horlicks is a nourishing beverage that helps support your child&rsquo;s growth.Key Features- Health Drink that has nutrients to support immunity.- Clinically proven to improve 5 signs of growth- Clinically proven to make kids Taller, Stronger &amp; Sharper- Scientifically proven to improve Power of Milk- Vegetarian productBenefits- Increases the density of minerals such as calcium in bones to give children bigger and stronger bones- Horlicks is clinically proven to increase lean tissue, making children stronger- Helps improve attention and concentration to make the child smarter- Clinically proven for more hemopoietic nutrients in the blood and to increase fat-free mass, making the child strongerIngredientsFlour of wheat (25%), Solids extracted from Malted Barley (23%), Milk Solids (14%), Sugar (Extracted from Cereal 13%), contains Glutens from wheat, Emulsifiers, Minerals, Acidity Regulators, Soy Protein Isolator, and Minerals.How to UseEnjoy with a cup of hot milk or a glass of cold milk.Care Instructions- Read the label carefully before use- Keep out of reach of children- Store in a cool dry place- Use under medical supervisionAbout the BrandHorlicks is a sweet malted milk hot drink powder developed by founders James and William Horlick. It was first sold as 'Horlick's Infant and Invalids Food,' soon adding 'aged and travellers' to their label. In the early 20th century, it was sold as a powdered meal replacement drink mix. It was then marketed as a nutritional supplement and manufactured by GlaxoSmithKline (Consumer Healthcare) in the United Kingdom, Malaysia, Australia, New Zealand, Hong Kong, Bangladesh, India, Sri Lanka, and Jamaica.","Dairy & Beverages > Beverages"
dmart1444,"Rajam Snacks Tikha Gathiya",Rajam,143,71,"Packaged Food","Snacks & Farsans","400 gm","Overview:Made from high quality besan flour, this savoury snack is perfect for tea time.Storage Condition:Store in a cool and dry place.","Packaged Food > Snacks & Farsans"
dmart1445,"Complan Kesar Badam Health Drink",Complan,325,295,"Dairy & Beverages",Beverages,"500 gm",India,"Dairy & Beverages > Beverages"
dmart1446,"Horlicks Chocolate Delight Jar",Horlicks,245,209,"Dairy & Beverages",Beverages,"500 gm","OverviewHorlicks Chocolate Delight now mixes instantly to give children the smoothest and chocolatiest Horlicks experience ever in a jiffy! No lumps, stirring or hassle while making a glass of Chocolate Horlicks. Mix in milk instantly and make so many yummy treats like Chocolate shakes, smoothies and frozen desserts! Let the kids enjoy their glass of milk the way they want to and finish before you know it.Key Features- Clinically proven health drink- Helps to increase calcium in bones of children- Aids to improve the memory of the children- Contains essential nutrients for overall developmentBenefits- Helps meet the requirements of essential nutrients in children.- Horlicks is clinically proven to improve 5 signs of growth and is clinically proven to make kids taller, stronger and sharper.- Horlicks is scientifically proven to improve power of milk.- Increases the density of minerals such as calcium in bones to give children bigger and stronger bones- Horlicks is clinically proven to increase lean tissue, making children stronger- Helps improve attention and concentration to make the child smarter.- Clinically proven for more hemopoietic nutrients in the blood and to increase fat-free mass, making the child strongerIngredientsWheat Flour(32%), Sugar , Malted Barley(extracted solids)(18%) ,Milk Powder(9%), COCOA Powder, Natural Colour(INS 150c), Minerals , Protein isolate ,Nature Identical Flavouring Substances , Acidity Regular(INS 501(ii),500(ii)),Vitamins Salt.How to UseEnjoy with a cup of hot milk or a glass of cold milk.Care Instructions- Read the label carefully before use- Keep out of reach of children- Store in a cool dry place- Use under medical supervisionAbout the BrandHorlicks is a sweet malted milk hot drink powder developed by founders James and William Horlick. It was first sold as 'Horlick's Infant and Invalids Food,' soon adding 'aged and travellers' to their label. In the early 20th century, it was sold as a powdered meal replacement drink mix.It was then marketed as a nutritional supplement and manufactured by GlaxoSmithKline (Consumer Healthcare) in the United Kingdom, Malaysia, Australia, New Zealand, Hong Kong, Bangladesh, India, Sri Lanka, and Jamaica.","Dairy & Beverages > Beverages"
dmart1447,"Garden Diet Bhel",Garden,55,35,"Packaged Food","Snacks & Farsans","140 gm","Overview:Garden Diet Bhel is the tasty Mumbai origin bhel, which is a good snacking option during tea time, snack time or during a tasty and healthy time pass particularly for the diet conscious people. A unique oil-re extraction hydro process is applied during the manufacturing of Gardens diet range and it directly lowers the fat content in all these snack optionsIngredientsPuffed Rice, Rice Flakes, Gram flour, Refined Palmolein oil, Roasted Gram, Iodised Salt, Turmeric Powder, Curry Leaves, Mustard Seeds, Cumin Seeds & Ground Spices.Care InstructionsStore in a cool and dry place.About the BrandGarden Namkeens stands for authenticity and meeting the expectations of every Indian, regardless of his or her region of origin. A brand of CavinKare, it caters to a wide variety of taste buds, alienating no one, and yet remaining original with its flavours and options.","Packaged Food > Snacks & Farsans"
dmart1448,"Haldiram's Phalhari Chiwda",Haldiram's,47,39,"Packaged Food","Snacks & Farsans","150 gm","
Sweet & salty snack with potatoes and peanuts.

*Actual packaging may vary from the Image
","Packaged Food > Snacks & Farsans"
dmart1449,"Garden Raita Boondi",Garden,60,45,"Packaged Food","Snacks & Farsans","140 gm","Overview:Garden Raita Boondi is prepared by frying drops of gram flour batter in oil.Garden Raita Boondi is very crispy and crunchy and can be had during meals or in snacks like bhel or pani puri.IngredientsGram Flour, Semolina, Vegetable Oil, Salt and Edible Starch.How To UseThis boondi can be used along with raita or to prepare South Indian mixture. It can be used to make famous Indian chat pani puri.Care InstructionsStore in a cool and dry place.About the BrandGarden Namkeens stands for authenticity and meeting the expectations of every Indian, regardless of his or her region of origin. A brand of CavinKare, it caters to a wide variety of taste buds, alienating no one, and yet remaining original with its flavours and options. ","Packaged Food > Snacks & Farsans"
dmart145,"Nutraj Mix Dry Fruits",Nutraj,399,259,Grocery,"Dry Fruits","450 gm","AllergenThis product has been packed in an integrated nuts and dried fruits processing unit, and may contain occasional traces of nuts and dried fruits.","Grocery > Dry Fruits"
dmart1450,"Garden Diet Chivda",Garden,55,38,"Packaged Food","Snacks & Farsans","140 gm","OverviewGarden Diet Chivda is a tasty and healthy Indian snack best suited for tea time and during tasty timepass with friends and family. It is called diet chivda as it is made from healthy ingredients. It is low in fat. It is very crispy and cruncy and compels you to munch on as soon as you have a mouthful. A unique oil-reextraction hydro process is applied during the manufacturing of Garden&rsquo;s diet range. It directly lowers the fat content in all these snack options.Care InstructionsStore in a cool and dry place.About The BrandGarden Namkeens stands for authenticity and meeting the expectations of every Indian, regardless of his or her region of origin. A brand of CavinKare, it caters to a wide variety of taste buds, alienating no one, and yet remaining original with its flavours and options.","Packaged Food > Snacks & Farsans"
dmart1451,"Protinex Health Drink Chocolate Flavour Tin",Protinex,399,350,"Dairy & Beverages",Beverages,"250 gm","  OverviewProtein is one of the most important everyday nutrients for all of us. However, due to a busy lifestyle, it gets difficult to meet our daily protein needs. Protinex is the perfect partner for you in the race of life. It has zero trans-fats and contains adequate amounts of nutrients making it an excellent addition to your diet. Every glass of Protinex adds a feeling of vigor and achievement in your life that propels you to achieve your goals.Key FeaturesIt has 10 Immuno NutrientsNutrients that support all day energyHelps bridge protein gapfrom dietHas zero added sugar with the same great tasteBenefitsProtein for growth and maintenance of muscle mass.Vitamin B1 & B2 to help in metabolism.Vitamin A, C, D, E, B12 & Folate to support immunity.Iron maintains the normal function of the immune system.IngredientsSoy Protein Isolate, Sucrose, Skimmed Milk Powder, Cocoa Powder (10%), Vitamins (Choline Bitartrate, Ascorbic Acid, Nicotinamide, Dl-Alpha Tocopherol Acetate, Retinyl Acetate, Riboflavin, Ergocalciferol, Thiamine Hydrochloride, Calcium Pantothenate, Pyridoxine Hydrochloride, Folic Acid, D-Biotin), Stabiliser (Guar Gum), Minerals (Ferric Pyrophosphate, Zinc Sulphate, Potassium Iodate), Maltodextrin. Contains Added Flavour - Nature Identical Flavouring Substances. Contains Soy Protein Isolate, Not Recommended For People Allergic To Peanut Or Soya.How to UseTake a mug of lukewarm or cold milk (200ml).Add 2-3 heaped tablespoon of Protinex Tasty Chocolate.Stir well before drinking.About the BrandProtinex has more than 60 years experience in partnering Indian Adults in their Nutrition Journey; contains Acti-Pro5 to provide protein-rich nutrition for everyday nutritional needsDisclaimer if anyDisclaimers: Protinex contains nutrients that support immune function, Nutrition and Health Claims  European Commission, 2016 Protinex contains nutrients that support energy¬ yielding metabolism and reduce tiredness and fatigue.Protinex should be consumed as part of a well balanced diet and healthy lifestyle. ","Dairy & Beverages > Beverages"
dmart1452,"Kurkure Masala Munch",Kurkure,20,18,"Packaged Food","Snacks & Farsans","77.2 gm","Overview Kurkure is the perfect savoury snack to have at tea time. The masala munch is a classic Kurkure flavour with a great combination of spice and crunch. Made with trusted kitchen ingredients, this snack is 100% Vegetarian.How to UseSurprise guests visit at home with a flavour that can win everyone&rsquo;s heart and satisfy their taste buds too! Share and enjoy your favourite snack - KurkureKey Features- Made with trusted kitchen ingredients such as corn, dal, and rice. - It is a 100% vegetarian snackShelf life in days120 DaysAbout the BrandKurkure is a crunchy, new-age namkeen snack brand that symbolizes light-hearted fun. Embodying the spirit of India, Kurkure has found a home in millions of hearts and minds and enjoys the position of a strong love mark brand in India. Made with trusted kitchen ingredients: 100% vegetarian all the raw materials used in Kurkure comply with the food safety & standards act & regulations 2006 and rules that govern the manufacture, distribution, and sale of Kurkure.","Packaged Food > Snacks & Farsans"
dmart1453,"Sitashree Laxminarayan Best Potato Chiwda",Laxminarayan,114,99,"Packaged Food","Snacks & Farsans","250 gm","Key Features- Fried potato sticks that are perfect for the fasting period.How to Use- Open the packet and eat it along with chai (tea) or as a side dish with meals.Benefits- Shree Laxminarayan products have no added Preservatives.- All flavours and ingredients are natural and of the best quality.Care Instructions- Keep the packet away from direct sunlight.About the BrandThe famous Chiwda brand started its journey in 1945 in Pune and now is known worldwide for its range of various kinds of chiwda and namkeen.","Packaged Food > Snacks & Farsans"
dmart1454,"Horlicks Chocolate Delight Health Drink Refill",Horlicks,239,201,"Dairy & Beverages",Beverages,"500 gm",India,"Dairy & Beverages > Beverages"
dmart1455,"Agrawal's 420 Khatta Meetha Mix","Agrawal's 420",250,125,"Packaged Food","Snacks & Farsans","900 gm","OverviewDelicious sweet and sour namkeen. Indori taste served differently. The product is packed using nitrogen in the 'Three Layer Aluminium Foil Pack' to maintain the freshness, taste and longer shelf life.Key Features- Premium quality- 100% vegetarian- 100% freshIngredientsEdible Vegetable Oil (27%) (Palmolein Oil and/or Cotton Seed Oil), Rice Flakes(20%), Gram Flour(20%), Sugar(14%), Gram Dal, Peanuts, Masoor Dal, Iodised Salt, Tumeric Powder, Citric Acid(0.33%), Spices Condiments.Storage ConditionStore in a clean, cool dry place. Keep away from direct sunlight strong odours. Once opened keep the material in the airtight container.","Packaged Food > Snacks & Farsans"
dmart1456,"Kurkure Green Chutney Style",Kurkure,20,18,"Packaged Food","Snacks & Farsans","77.2 gm","Overview Add a dash of chatpatapan and masti to your moments with the crunchy and crispy Kurkure Green Chutney chips.How to UseKurkure is the perfect savoury snack to have at tea time.Key Features- Made with trusted kitchen ingredients such as corn, dal, and rice. - It is a 100% vegetarian snackShelf life in days120 DaysAbout the BrandKurkure is a crunchy, new-age namkeen snack brand that symbolizes light-hearted fun. Embodying the spirit of India, Kurkure has found a home in millions of hearts and minds and enjoys the position of a strong love mark brand in India. Made with trusted kitchen ingredients: 100% vegetarian all the raw materials used in Kurkure comply with the food safety & standards act & regulations 2006 and rules that govern the manufacture, distribution, and sale of Kurkure.","Packaged Food > Snacks & Farsans"
dmart1457,"Hershey's Natural Unsweetened Cocoa Powder",Hershey's,285,255,"Dairy & Beverages",Beverages,"225 gm","
The Natural antioxidant found in tea and certain fruits can also be found in Hershey's Unsweetned Cocoa.
- 100 percent Cocoa - Natural Unsweetened.
- The natural antioxidants found in tea and certain fruits can also be found in Hershey's unsweetened cocoa.
- Is ideal for hot cocoa, frostings, cakes, brownies and other rich chocolate desserts.
","Dairy & Beverages > Beverages"
dmart1458,"Charliee Masala Butter Chakli",Charliee,74,37,"Packaged Food","Snacks & Farsans","100 gm",India,"Packaged Food > Snacks & Farsans"
dmart1459,"Garden Sabudana Chivda",Garden,55,35,"Packaged Food","Snacks & Farsans","140 gm","Overview:Highly beneficial for people who prefer non-oily and fat free healthy food. Gardens Sabudana Chivda provides various health nutrients and is a wholesome meal.IngredientsSago (30%), Refined Palmolein Oil, Peanuts (20%),Potato (19%), Sugar (14%),Cumin (0.5%)and Edible Common Salt.Care InstructionsStore in a cool and dry place.About the BrandGarden Namkeens stands for authenticity and meeting the expectations of every Indian, regardless of his or her region of origin. A brand of CavinKare, it caters to a wide variety of taste buds, alienating no one, and yet remaining original with its flavours and options. ","Packaged Food > Snacks & Farsans"
dmart146,"Satyam Masoor Whole",Satyam,90,83,Grocery,Pulses,"500 gm","OverviewMasoor dal is one of the most important elements of the Indian diet. It is a good source of protein and iron. It is a very easy dal to prepare which you can savour with rice, rotis, bread, or anything you like. It has a savoury and gentle taste that you will never get enough of.Key Features- Great taste- Good source of protein- Easy to prepareStorage InstructionsStore in a cool and dry place. Transfer contents in an airtight container after opening.","Grocery > Pulses"
dmart1460,"Kurkure Chilli Chatka",Kurkure,20,18,"Packaged Food","Snacks & Farsans","81 gm","Overview Your search for spicy namkeen snacking ends right here. Try the Tedhe Medhe Kurkure Chilli Chataka to get that extra crunch and spice to your snacking time.&nbsp;How to UseKurkure is the perfect savoury snack to have at tea time.Key Features- Made with trusted kitchen ingredients such as corn, dal, and rice. - It is a 100% vegetarian snackShelf life in days120 DaysAbout the BrandKurkure is a crunchy, new-age namkeen snack brand that symbolizes light-hearted fun. Embodying the spirit of India, Kurkure has found a home in millions of hearts and minds and enjoys the position of a strong love mark brand in India. Made with trusted kitchen ingredients: 100% vegetarian all the raw materials used in Kurkure comply with the food safety & standards act & regulations 2006 and rules that govern the manufacture, distribution, and sale of Kurkure.","Packaged Food > Snacks & Farsans"
dmart1461,"Amul Premium Dahi",Amul,58,46,"Dairy & Beverages",Dairy,"400 gm","OverviewAmul Premium Dahi is hygienically processed and packed in a reusable plastic tub as well as convenient pouch and thus free from possible adulteration.","Dairy & Beverages > Dairy"
dmart1462,"Taali Protein Cheese & Herbs Puffs",Taali,79,39,"Packaged Food","Snacks & Farsans","74 gm","OverviewA cheesy road trip down to the aromatic romance of herbs! We all love some cheese; be it in our movies or our favourite snack! Taali's Cheese & Herbs Protein Puffs are mixed with an herb infusion that gives your taste buds an extravaganza of rich flavours. Been dreaming of delicious, guilt free chips and snacks that fulfil your daily protein needs? Making that dream come true, Taali’s Protein Puffs are a revolutionary healthy snack, combining the goodness of super grains like Jowar, Chickpeas, Lentils and Soy into delicious puffs. We often don't get the amount of protein our body demands, which is what led to the invention these puffs, which give you 12 grams of protein per bag! Taali Protein Puffs give you more protein than 2 glasses of milk, 2 eggs or 3 bowls of daal and are also a great source of fiber. And the best part about them? They are gluten free roasted snacks made without maida, corn, wheat or any other junk and contain 60% less fat than potato chips! No MSG, No Trans Fat and No Preservatives! Taali's Protein Puffs are suitable for all ages. So order Taali Cheese & Herbs Protein Puffs online today, and share them with your loved ones!IngredientsTaali Protein Puff Blend (Jawar, Chickpeas, Urad Daal, Rice, Soy Protein Isolate), Cheese Seasoning (Corn Starch, Iodised Salt, Sugar, Milk Solids, Spices & Condiments (Onion, Garlic, Parsley, Oregano), Cheese Powder, Yeast Extract Powder, Acidity Regulator (INS 270), Edible Vegetable Oil)","Packaged Food > Snacks & Farsans"
dmart1463,"Taali Protein Masala Mania Puffs",Taali,79,39,"Packaged Food","Snacks & Farsans","74 gm","OverviewA punch of tadka and a hit of masala; No guilt guaranteed! For all you Indian food lovers, this desi blend of spices and heat-induced masaledar tadka sprinkled on to every protein puff is going to leave you shook. This flavour comes with a warning: A punch of masala awaits you. Beware snack eater, you may just end up craving more! Been dreaming of delicious, guilt free chips and snacks that fulfill your daily protein needs? Here’s us, making that dream come true! Taali’s Protein Puffs are a revolutionary healthy snack, combining the goodness of super grains like Jowar, Chickpeas, Lentils and Soy into a delicious puff. We often don't get the amount of protein our body demands, which is what led us to inventing these puffs, which give you 12 grams of protein per bag! Our puffs give you as much protein as 2 glasses of milk, 2 eggs or 3 bowls of daal and are also a great source of fiber. And the best part about them? They are gluten free roasted snacks made without maida, corn, wheat or any other junk and contain 60% less fat than potato chips! No MSG, No Trans Fat and No Preservatives ! Taali Protein Puffs are great healthy snacks for all ages, kids and adults both enjoy them because of the delicious taste and protein content. So order Taali Masala Mania Protien Puffs onine today and share them with your loved ones!IngredientsTaali Protein Puff Blend (Jawar, Chickpeas, Urad Daal, Rice, Soy Protein Isolate), Cream & Onion Seasoning (Sugar, Milk Solids, Iodised Salt, Onion Powder, Parsley, Chives, Acidity Regulators (330, 270), Corn Starch), Edible Vegetable Oil","Packaged Food > Snacks & Farsans"
dmart1464,"Agrawal's 420 Laung Sev","Agrawal's 420",60,30,"Packaged Food","Snacks & Farsans","150 gm","OverviewIndulge in mouth-watering Indori snacks like this Laung Sev, made with gram flour sev and a dash of clove or laung for extra zing.Product is packed using nitrogen in the 'Three Layer Aluminium Foil Pack' to maintain the freshness, taste and longer shelf life.Key Features- 100% vegetarian- 100% fresh- Premium quality- True taste of Indian Snacks- Made from best quality ingredientsIngredientsGram flour (57%), Edible Vegetable Oil(38%) (Palmolein Oil and/or Cotton Seed Oil), Iodised salt, Red Chilli Powder, Ajwain, Clove(0.55), Black Pepper, Asafoetida, Spices & Condiments.Care InstructionsStore in a clean, cool & dry place. Keep away from direct sunlight & strong odours. Once opened keep the material in the airtight container.About the BrandThe company was started by Mr. Agrawal in 1962. And, 420 Namkeen was established in 1998. It has successfully captured the soul of Malwa culture and the essence of Indore in the taste of variety of 420 Namkeen and sweets. Today Agrawal Snacks Food is one of the distinguished and leading manufacturer and exporters of namkeen (savouries) and sweets from India.","Packaged Food > Snacks & Farsans"
dmart1465,"Sun Special Masala Chakli",Sun,62,31,"Packaged Food","Snacks & Farsans","100 gm","OverviewMasala Chakli is a spiral-shaped crisp deep-fried snack that is renowned all over India. It is a light snack that is very crispy and tasty. It is perfect to have on a cold, rainy day, with a hot cup of chai.IngredientsUdad flour, Starch, Salt, Edible Palm Oil, Red Chilly Powder","Packaged Food > Snacks & Farsans"
dmart1466,"Agrawal's 420 Ujjaini Sev","Agrawal's 420",60,30,"Packaged Food","Snacks & Farsans","150 gm","OverviewCrispy sev for tea time snacks. Indori taste served differently. Product is packed using nitrogen in the 'Three Layer Aluminium Foil Pack' to maintain the freshness, taste and longer shelf life.Key Features- Premium quality- 100% vegetarian- 100% freshIngredientsGram flour (57%), Edible Vegetable Oil (38%) (Palmolein Oil and/or Cotton Seed Oil, Iodised Salt, Red Chilli Powder, Ajwain, Black Pepper, Clove, Asafoetida, Spices Condiments.Storage ConditionStore in a clean, cool dry place. Keep away from direct sunlight strong odours. Once opened keep the material in the air tight container.","Packaged Food > Snacks & Farsans"
dmart1467,"Rajam Snacks Golden Mix","Rajam Snacks",167,83,"Packaged Food","Snacks & Farsans","400 gm","About ProductGolden Mix Farsan is an Indian snack mix (namkeen) that consists of a variable mixture of spicy dried ingredients, such as fried lentils, peanuts, chickpea flour ghatia, vegetable oil, chickpeas, and flaked rice.","Packaged Food > Snacks & Farsans"
dmart1468,"Taali Protein Cream & Onion Puffs",Taali,79,39,"Packaged Food","Snacks & Farsans","74 gm","OverviewCreamy and protein rich all at the same time; we know it's confusing but we just cannot stop eating these delicious bite-sized snacks. The puffs are made with the perfect ingredients and sprinkled with a creamy, herb-rich topping. And just when you think it can’t get any better, the freshness of onion kicks in to add a perfect counter of flavors to this creamy delight. Try today, crave everyday! Been dreaming of delicious, guilt free chips and snacks that fulfill your daily protein needs? Here’s us, making that dream come true! Taali’s Protein Puffs are a revolutionary healthy snack, combining the goodness of super grains like Jowar, Chickpeas, Lentils and Soy into a delicious puff. We often don't get the amount of protein our body demands, which is what led us to inventing these puffs, which give you 12 grams of protein per bag! Our puffs give you as much protein as 2 glasses of milk, 2 eggs or 3 bowls of daal and are also a great source of fiber. And the best part about them? They are gluten free roasted snacks made without maida, corn, wheat or any other junk and contain 60% less fat than potato chips! No MSG, No Trans Fat and No Preservatives ! Taali Protein Puffs are great healthy snacks for all ages, kids and adults both enjoy them because of the delicious taste and protein content. So order Taali Cream & Onion Protien Puffs online today and share them with your loved ones!IngredientsTaali Protein Puff Blend (Jawar, Chickpeas, Urad Daal, Rice, Soy Protein Isolate), Cream & Onion Seasoning (Sugar, Milk Solids, Iodised Salt, Onion Powder, Parsley, Chives, Acidity Regulators (330, 270), Corn Starch), Edible Vegetable Oil","Packaged Food > Snacks & Farsans"
