p_id,Name,Brand,Price,DiscountedPrice,Category,SubCategory,Quantity,Description,BreadCrumbs
dmart1678,"McCain Smiles - Crispy Happy Potatoes",McCain,345,315,"Packaged Food","Snacks & Farsans","1.25 Kg","RecipeMcCain Smiles CanapePreparation Time - 10 minutes1 Piece McCain Smiles;1 Pc Lettuce1/4 Jalapenos (finely chopped);1 cheese slice triangle;1/4 tsp Sour cream;1 black Olive (sliced);1/4 tsp Pimento (chopped);Gherkin - as required.Deep Fry McCain Smiles for 3 minutes or until golden. Place it on a platter, layer with a leaf of lettuce, top with finely chopped jalapenos. Place the slice of cheese triangle on top. Pipe sour cream on it. Garnish with a slice of black olive, chopped Pimento and a fan of Gherkin. Serve.Storage DirectionKeep Frozen at -18&deg; C or belowHow to Use*Deep Fry - Step 1 - Pre heat the oil in Kadhai/Wok (maximum temperature upto 175&deg; C)Step 2 - Take the product from the freezer, Fry Directly - DO NOT THAWStep 3 - Put the desired quantity gently in hot oil and deep fry for 3 minutesStep 4 - Seal and keep the remaining product in the freezerBake (Air Fryer)Pre heat the air fryer to 200&deg; C. Bake (approx. 1/4th pack) for 16-18&deg; Couple of times in between.NOT SUITABLE FOR MICROWAVE COOKING, REDUCE COOKING TIME WHEN COOKING SMALLER QUANTITIES.Instructions- Transfer to the freezer compartment at the earliest.- Use straight from the freezer - thawing not required.- Put unused product back to the freezer at the earliest.Note : This product is eligible for return ONLY at the time of delivery. Once delivered, it cannot be returned.","Packaged Food > Snacks & Farsans"
dmart1679,"Prasuma Cheesy Spicy Veg Frozen Momos",Prasuma,325,255,"Packaged Food","Snacks & Farsans","24 Pcs","OverviewQuick, easy, healthy and delicious!Give your meal a healthy twist with our incredibly tasty Prasuma Momos. Made from fresh high-quality vegetables paneer, Prasuma Momos are quick easy to prepare, delicious and of restaurant-quality.You can now enjoy hot tasty Momos at home everyday.How to UseThese Momos are already Pre-Steamed. Do not overcookSteam : Oil Momo/Idli tray. Steam Momo in a Momo/Idli tray for 5 minutes.Deep Fry : Deep-fry Momo for 5 minutes or until golden brown.Shallow Fry : Add 1 tablespoon of oil 1/4 cup of water into a non-stick pan and add Momo. Cover pan and cook for about 5 minutes. Remove cover cook until water has evaporated and the base is brown and crispy.Soup : Add cooked Momo to any soup/curry for a healthy Momo soup.Serve hot with our Signature Momo Sauce included inside.Key Features- Made from Fresh High Quality Vegetables Paneer- Momo Sauce Inside- Thin Wrapper, Juicy Filling- No Preservatives- Ready in 5 MinutesBenefits- A snack for everyone - Loved by both kids and adults.- A treat for every mood - Enjoy it with your friends, family or even by yourself.- A guaranteed showstopper - During house parties, match days or movie marathons.Any Other Must-Know InformationStorage: The product is Packed Sealed. Store the Product in Freezer.About the BrandFor over 30 years, we at Prasuma have been doing things our own way. From the very beginning, we chose to only bring to market products that we believe in, unwilling to compromise on quality or cut corners.Our passion to deliver superior quality products have made us a leader in our industry. Prasuma is a brand in which consumers continue to place their trust, everyday.","Packaged Food > Snacks & Farsans"
dmart168,"Premia Groundnut",Premia,107,88,Grocery,Pulses,"500 gm","IngredientsGroundnutStorageStore in a cool and dry place","Grocery > Pulses"
dmart1680,"Act II Butter Pepper Popcorn","ACT II",35,31,"Packaged Food","Snacks & Farsans","70 gm",India,"Packaged Food > Snacks & Farsans"
dmart1681,"McCain Smiles - Crispy Happy Potatoes",McCain,130,115,"Packaged Food","Snacks & Farsans","415 gm","RecipeMcCain Smiles CanapePreparation Time - 10 minutes1 Piece McCain Smiles;1 Pc Lettuce1/4 Jalapenos (finely chopped);1 cheese slice triangle;1/4 tsp Sour cream;1 black Olive (sliced);1/4 tsp Pimento (chopped);Gherkin - as required.Deep Fry McCain Smiles for 3 minutes or until golden. Place it on a platter, layer with a leaf of lettuce, top with finely chopped jalapenos. Place the slice of cheese triangle on top. Pipe sour cream on it. Garnish with a slice of black olive, chopped Pimento and a fan of Gherkin. Serve.Storage DirectionKeep Frozen at -18&deg; C or belowHow to Use*Deep Fry - Step 1 - Pre heat the oil in Kadhai/Wok (maximum temperature upto 175&deg; C)Step 2 - Take the product from the freezer, Fry Directly - DO NOT THAWStep 3 - Put the desired quantity gently in hot oil and deep fry for 3 minutesStep 4 - Seal and keep the remaining product in the freezerBake (Air Fryer)Pre heat the air fryer to 200&deg; C. Bake (approx. 1/4th pack) for 16-18&deg; Couple of times in between.NOT SUITABLE FOR MICROWAVE COOKING, REDUCE COOKING TIME WHEN COOKING SMALLER QUANTITIES.Key IngredientsPotato (62.84%), Potato Flakes (13.76%), Palmolien Oil, Corn Flour, Edible Common Salt.Instructions- Transfer to the freezer compartment at the earliest.- Use straight from the freezer - thawing not required.- Put unused product back to the freezer at the earliest.Note : This product is eligible for return ONLY at the time of delivery. Once delivered, it cannot be returned.","Packaged Food > Snacks & Farsans"
dmart1682,"ITC Master Chef Veggie Pizza Pocket","Master Chef",170,150,"Packaged Food","Snacks & Farsans","340 gm","
A pocket full of fun. All the Classic Flavours of a pizza- cheese, capsicum, onion, sweet corn and oregano seasoning stuffed in a golden pocket.

Note : This product is eligible for return ONLY at the time of delivery. Once delivered, it cannot be returned.
","Packaged Food > Snacks & Farsans"
dmart1683,"Natural's Bite Roasted Yellow Chana","Natural's Bite",65,32,"Packaged Food","Snacks & Farsans","200 gm","Key FeaturesIngredient Type: VegetarianShelf Life6 Months  IngredientsChana, Iodized Salt, Turmeric Powder (Yellow Chana),","Packaged Food > Snacks & Farsans"
dmart1684,"McCain Smiles - Crispy Happy Potatoes",McCain,215,180,"Packaged Food","Snacks & Farsans","750 gm","RecipeMcCain Smiles CanapePreparation Time - 10 minutes1 Piece McCain Smiles;1 Pc Lettuce1/4 Jalapenos (finely chopped);1 cheese slice triangle;1/4 tsp Sour cream;1 black Olive (sliced);1/4 tsp Pimento (chopped);Gherkin - as required.Deep Fry McCain Smiles for 3 minutes or until golden. Place it on a platter, layer with a leaf of lettuce, top with finely chopped jalapenos. Place the slice of cheese triangle on top. Pipe sour cream on it. Garnish with a slice of black olive, chopped Pimento and a fan of Gherkin. Serve.Storage DirectionKeep Frozen at -18&deg; C or belowHow to Use*Deep Fry - Step 1 - Pre heat the oil in Kadhai/Wok (maximum temperature upto 175&deg; C)Step 2 - Take the product from the freezer, Fry Directly - DO NOT THAWStep 3 - Put the desired quantity gently in hot oil and deep fry for 3 minutesStep 4 - Seal and keep the remaining product in the freezerBake (Air Fryer)Pre heat the air fryer to 200&deg; C. Bake (approx. 1/4th pack) for 16-18&deg; Couple of times in between.NOT SUITABLE FOR MICROWAVE COOKING, REDUCE COOKING TIME WHEN COOKING SMALLER QUANTITIES.Key IngredientsPotato (62.84%), Potato Flakes (13.76%), Palmolien Oil, Corn Flour, Edible Common Salt.Instructions- Transfer to the freezer compartment at the earliest.- Use straight from the freezer - thawing not required.- Put unused product back to the freezer at the earliest.Note : This product is eligible for return ONLY at the time of delivery. Once delivered, it cannot be returned.","Packaged Food > Snacks & Farsans"
dmart1685,"Mccain Emotibites",McCain,250,199,"Packaged Food","Snacks & Farsans","750 gm","IngredientsPotato (63%), Potato Flakes (13%), Palmolein Oil, Corn Flour, Iodized Salt.Instructions- Transfer to the freezer compartment at the earliest.- Use straight from the freezer - thawing not required.- Put unused product back to the freezer at the earliest.","Packaged Food > Snacks & Farsans"
dmart1686,"Jabsons Roasted Peanuts Hing Jeera",Jabsons,70,56,"Packaged Food","Snacks & Farsans","140 gm","OverviewBest quality Indian Peanuts are roasted in the age-old hand roasting process of Gujarat. This process gives natural sweetness, true roasted flavour & golden brown colour to the peanuts.IngredientsPeanuts, Refined Cottonseed Oil, Red Chilli, Citric Acid, Asafoetida, Cumin, Salt, Maltodextrin.StorageStore in a Cool and Dry Place.","Packaged Food > Snacks & Farsans"
dmart1687,"McCain Chilli Cheesy Nuggets",Mccain,225,170,"Packaged Food","Snacks & Farsans","400 gm","
Note : This product is eligible for return ONLY at the time of delivery.

Once delivered, it cannot be returned.
","Packaged Food > Snacks & Farsans"
dmart1688,"Godrej Yummiez Potato Cheese Bites",Godrej,225,112,"Packaged Food","Snacks & Farsans","400 gm","OverviewYou can never go wrong with the combination of potato and cheese specially crafted to pamper your taste buds. Filled with flavours and goodness of cheese, these potato cheese bites are surely an anthem for every party IngredientsPotato, Cheese, Milk Solids, Vegetable Fats, Modified Starch, Emulsifiers, Iodised Salt, Preservative, Acidity Regulator, Bread Crumb, Maida, Yeast, Salt, Dextrose, Preservative & Acidity Regulator, Water, Batter, Maida, Corn Starch, Salt, Stabiliser & Raising Agent, Edible Vegetable Oil Refined Palm olien Oil, Milk Solids, Refined Flour, Starch, Chili Flakes, Corn, Flour, Basils, Onion, Wheat Fibre. How to Use- Deep Fry/Shallow Fry/Air Fry.","Packaged Food > Snacks & Farsans"
dmart1689,"McCain Veggie Burger Patty",McCain,135,99,"Packaged Food","Snacks & Farsans","360 gm","
Instructions :
- Transfer to the freezer compartment at the earliest.
- Use straight from the freezer - thawing not required.
- Put unused product back to the freezer at the earliest.

Note : This product is eligible for return ONLY at the time of delivery. Once delivered, it cannot be returned.
","Packaged Food > Snacks & Farsans"
dmart169,Makhana,,193,170,Grocery,"Dry Fruits","200 gm","Overview:Makhana is the seed of the lotus plant that is used in the preparation of sweets as well as savories. These seeds can be consumed raw or in cooked form. Makhana is also used for medicinal purposes. Makhana has high nutritional value as it is a rich source of proteins, carbohydrates, fiber, potassium, iron, and zinc. It gives a feeling of fullness when taken as a snack and prevents overeating thereby helping in weight loss. Makhana is beneficial for overall skin health (wrinkles and signs of aging) due to the presence of antioxidants and certain amino acids that have anti-aging property.According to Ayurveda, Makhana helps improve male sexual health as it increases sperm quality and quantity due to its aphrodisiac property. Eating Makhana might also help control diarrheal as its strong astringent property helps slow down the passage of stool through the digestive tract thereby reducing the frequency of passing stool.How to UseMakhanaTake 1-2 handful Makhana or as per your requirement.Or, you can also add a few Makhana to your salads. Roasted Makhana Heat oil in a pan on full flame. Once the oil is hot, bring the flame to a simmer. Add the Makhana and roast until crunchy. Season the Makhana with salt, black pepper powder and chaat masala (optional). Eat 2-3 handfuls a day or add to salads. Makhana powder (or Makhana flour) Take 2-3 cups of Makhana and grind it to form powder. Take ½ cup of Makhana powder in a bowl. Add hot water in small quantities and mix well with a spoon or whisk. Make sure no lumps remain. Add ghee at the end and mix well. Let it cool and add honey before having.Frequently Asked Questions1: What are the synonyms of Makhana?Ans: Euryale ferox, Makhatram, Paniyphalam, Makhatrah, Kantpadma, Mellunipadmamu, Makhna, Jeweir, Makhane, Makhane, Sivsat, Thanging, Gorgon fruits, Prickly water lily, Makhana lawah, Mukhresh, Mukhareh, Fox nut2: What is the source of Makhana?Ans:Plant Based","Grocery > Dry Fruits"
dmart1690,"Prasuma Mixed Veg Frozen Momos",Prasuma,210,145,"Packaged Food","Snacks & Farsans","15 Pcs","OverviewQuick, easy, healthy and delicious!Give your meal a healthy twist with our incredibly tasty Prasuma Momos. Made from fresh high-quality vegetables, Prasuma Momos are quick easy to prepare, delicious and of restaurant-quality.You can now enjoy hot tasty Momos at home everyday.How to UseThese Momos are already Pre-Steamed. Do not overcookSteam : Oil Momo/Idli tray. Steam Momo in a Momo/Idli tray for 5 minutes.Deep Fry : Deep-fry Momo for 5 minutes or until golden brown.Shallow Fry : Add 1 tablespoon of oil 1/4 cup of water into a non-stick pan and add Momo. Cover pan and cook for about 5 minutes. Remove cover cook until water has evaporated and the base is brown and crispy.Soup : Add cooked Momo to any soup/curry for a healthy Momo soup.Serve hot with our Signature Momo Sauce included inside.Key Features- Made from Fresh High Quality Vegetables- Momo Sauce Inside- Thin Wrapper, Juicy Filling- No Preservatives- Ready in 5 MinutesBenefits- A snack for everyone - Loved by both kids and adults.- A treat for every mood - Enjoy it with your friends, family or even by yourself.- A guaranteed showstopper - During house parties, match days or movie marathons.Any Other Must-Know InformationStorage: The product is Packed Sealed. Store the Product in Freezer.About the BrandFor over 30 years, we at Prasuma have been doing things our own way. From the very beginning, we chose to only bring to market products that we believe in, unwilling to compromise on quality or cut corners.Our passion to deliver superior quality products have made us a leader in our industry. Prasuma is a brand in which consumers continue to place their trust, everyday.","Packaged Food > Snacks & Farsans"
dmart1691,"McCain Aloo Tikki",McCain,115,105,"Packaged Food","Snacks & Farsans","400 gm",India,"Packaged Food > Snacks & Farsans"
dmart1692,"Godrej Yummiez Green Peas",Godrej,150,75,"Packaged Food","Snacks & Farsans","500 gm","
Instructions :
- Transfer to the freezer compartment at the earliest.
- Put unused product back to the freezer at the earliest.
","Packaged Food > Snacks & Farsans"
dmart1693,"ITC Master Chef Veg Burger Patty",ITC,175,87,"Packaged Food","Snacks & Farsans","540 gm",India,"Packaged Food > Snacks & Farsans"
dmart1694,"Sumeru Piri Piri Masala French Fries - Crispy & Spicy",Sumeru,245,122,"Packaged Food","Snacks & Farsans","800 gm","
Instructions :
- Transfer to the freezer compartment at the earliest.
- Use straight from the freezer - thawing not required.
- Put unused product back to the freezer at the earliest.

Note : This product is eligible for return ONLY at the time of delivery. Once delivered, it cannot be returned.
","Packaged Food > Snacks & Farsans"
dmart1695,"Godrej Yummiez Crispy Veg Sticks",Godrej,130,65,"Packaged Food","Snacks & Farsans","320 gm","OverviewGodrej Yummiez Crispy Veg Stick stuffed with garden-fresh greens mixed with chef secret spice blend and a hint of garlic, coated with a crunchy coating, Mouth-watering enough? Dive into the total snack feels and make the evening fun-filled with Crispy Veg Stick. IngredientsMixed Vegetable, Potato, Corn, Peas, Carrot, Coriander, Water, Bread Crumb Maida, Stabiliser, Salt, Wheat Gluten, Dextrose, Yeast, Edible, Spice and Condiments, Edible Vegetable Oil, RBD Palmolive oil, Batter Maida, Starch, Salt, Maize Flour, Stabiliser, & Raising Agent, Garlic, Starch, Wheat Fibre, Iodised Salt.  How to Use- Deep Fry/Shallow Fry/Air Fry.","Packaged Food > Snacks & Farsans"
dmart1696,"McCain Chilli Garlic Potato Bites",McCain,140,112,"Packaged Food","Snacks & Farsans","420 gm",India,"Packaged Food > Snacks & Farsans"
dmart1697,"ITC Master Chef Chilli Garlic Potato Shots",ITC,145,72,"Packaged Food","Snacks & Farsans","500 gm","OverviewThere&rsquo;s something undeniably satisfying about popping these chilli garlic potato shots. Perfect food for a bar menu and ideal for a platter or as a side to a main dishHow to UseAir Fry/ Bake/ Shallow Fry/ Deep Fry","Packaged Food > Snacks & Farsans"
dmart1698,"Jabsons Roasted Peanuts Black Pepper",Jabsons,70,56,"Packaged Food","Snacks & Farsans","140 gm","OverviewRoasted in the age-old Hand roasting process of Gujarat, this process gives it natural sweetness, true roasted flavour & golden brown colour to the peanuts, black pepper peanuts-mildly spiced mouth-watering roasted peanuts, seasoned with black pepper & Indian spices.IngredientsPeanuts, Refined Cottonseed Oil, Black Pepper, Salt, Dry Mango, Cloves & Lemon.StorageStore in a cool and dry place.","Packaged Food > Snacks & Farsans"
dmart1699,"Sitashree Laxminarayan Lite Chiwda",Laxminarayan,72,64,"Packaged Food","Snacks & Farsans","250 gm","Key Features- Lite poha that is perfect for people on diet and on fast.How to Use- Open the packet and eat it along with chai (tea) or as a side dish with meals.Benefits- Shree Laxminarayan products have no added Preservatives.- All flavours and ingredients are natural and of the best quality.Care Instructions- Keep the packet away from direct sunlight.About the BrandThe famous Chiwda brand started its journey in 1945 in Pune and now is known worldwide for its range of various kinds of chiwda and namkeen.","Packaged Food > Snacks & Farsans"
dmart17,"DMart Healthy Choice Unpolished Chana Dal","DMart Healthy Choice",117,94,Grocery,Dals,"1 kg","OverviewFor most Indians, comfort food is always linked to easy-to-cook homemade meals and what can be the most convenient and quick to prepare dal. A staple in the Indian diet, Chana dal has a rich flavour and aroma and provides protein. It can also be used in a variety of soups, salads, sweets, pakoras, and savouries. Essential in every household, Tata Sampann Chana dal is unpolished as it does not undergo any artificial polishing with water, oil, or leather thereby retaining its goodness and wholesomeness.The 5-step process ensures that Chana dal grains are uniform and of premium quality, giving you an all-natural, authentic taste. So, whenever you are in the mood to cook something easy and delicious, dive into the scrumptious taste of Chana dal, and enjoy a lovely meal!How to UseAmazing Recipes : Used in a variety of soups, salads, sweets, pakoras, and savouries.Storage Store in a cool and dry place. Transfer contents in an airtight container after opening.","Grocery > Dals"
dmart170,"Premia Groundnut",Premia,215,179,Grocery,Pulses,"1 kg",India,"Grocery > Pulses"
dmart1700,"Prasuma Vegetable Frozen Momos",Prasuma,295,220,"Packaged Food","Snacks & Farsans","24 Pcs","OverviewQuick, easy, healthy and delicious!Give your meal a healthy twist with our incredibly tasty Prasuma Momos. Made from fresh high-quality vegetables paneer, Prasuma Momos are quick easy to prepare, delicious and of restaurant-quality.You can now enjoy hot tasty Momos at home everyday.How to UseThese Momos are already Pre-Steamed. Do not overcookSteam : Oil Momo/Idli tray. Steam Momo in a Momo/Idli tray for 5 minutes.Deep Fry : Deep-fry Momo for 5 minutes or until golden brown.Shallow Fry : Add 1 tablespoon of oil 1/4 cup of water into a non-stick pan and add Momo. Cover pan and cook for about 5 minutes. Remove cover cook until water has evaporated and the base is brown and crispy.Soup : Add cooked Momo to any soup/curry for a healthy Momo soup.Serve hot with our Signature Momo Sauce included inside.Key Features- Made from Fresh High Quality Vegetables Paneer- Momo Sauce Inside- Thin Wrapper, Juicy Filling- No Preservatives- Ready in 5 MinutesBenefits- A snack for everyone - Loved by both kids and adults.- A treat for every mood - Enjoy it with your friends, family or even by yourself.- A guaranteed showstopper - During house parties, match days or movie marathons.Any Other Must-Know InformationStorage: The product is Packed Sealed. Store the Product in Freezer.About the BrandFor over 30 years, we at Prasuma have been doing things our own way. From the very beginning, we chose to only bring to market products that we believe in, unwilling to compromise on quality or cut corners.Our passion to deliver superior quality products have made us a leader in our industry. Prasuma is a brand in which consumers continue to place their trust, everyday.","Packaged Food > Snacks & Farsans"
dmart1701,"Switz Samosa Dough Sheet",Switz,60,45,"Packaged Food","Snacks & Farsans","250 gm","IngredientsRefined Wheat Flour (Maida-Gluten), Water, Salt, Edible Vegetable Fat, Preservative E282. Allergen Advice: For Allergen, Including Cereals Containing Gluten Please See Ingredients In Bold.
Note : This product is eligible for return ONLY at the time of delivery. Once delivered, it cannot be returned.
","Packaged Food > Snacks & Farsans"
dmart1702,"Charliee Rajgira Chikki",Charliee,92,46,"Packaged Food","Snacks & Farsans","150 gm","Ingredientsjaggery (30%)Sugar (15%)Peanut (13%)Liquid Glucose (9%)Allergy Advice: May contain peanuts, tree nuts, wheat, soy & sesame.About the BrandIn 1992 when visionary founders Mr. Shantilal Kalyanji Savla & Mrs. Jayaben Shantilal Savla laid the foundation of the brand Charliee Chikki & Snacks with a mission to serve globally traditional Indian snacks loaded with nutrition and great taste. They take great pride in enduring this beautiful journey & aim to even take it higher with adding more happy customers to Charliee family.","Packaged Food > Snacks & Farsans"
dmart1703,"Godrej Yummiez Veg Masala Nuggets",Godrej,175,87,"Packaged Food","Snacks & Farsans","400 gm","Key Features- Freshness locked and nutrients retained at -18 degree c.- Individual quick freezing technology.- Ready to cook.","Packaged Food > Snacks & Farsans"
dmart1704,"Sumeru Malabar Paratha",Sumeru,115,57,"Packaged Food","Snacks & Farsans","300 gm","
Instructions :
-· Transfer to the freezer compartment at the earliest.
-· Use straight from the freezer - thawing not required.
-· Put unused product back to the freezer at the earliest.
","Packaged Food > Snacks & Farsans"
dmart1705,"Safal Frozen French Fries",Safal,100,80,"Packaged Food","Snacks & Farsans","400 gm","
Note : This product is eligible for return ONLY at the time of delivery. Once delivered, it cannot be returned.
","Packaged Food > Snacks & Farsans"
dmart1706,"Sitashree Laxminarayan Shabuflakes Chiwda",Laxminarayan,78,62,"Packaged Food","Snacks & Farsans","250 gm","Key Features- Fried shabuflakes sticks that are perfect for the fasting period.How to Use- Open the packet and eat it along with chai (tea) or as a side dish with meals.Benefits- Shree Laxminarayan products have no added Preservatives.- All flavours and ingredients are natural and of the best quality.Care Instructions- Keep the packet away from direct sunlight.About the BrandThe famous Chiwda brand started its journey in 1945 in Pune and now is known worldwide for its range of various kinds of chiwda and namkeen.","Packaged Food > Snacks & Farsans"
dmart1707,"Sumeru Vegetable Spring Rolls",Sumeru,135,67,"Packaged Food","Snacks & Farsans","200 gm","OverviewCrispy Wassup Vegetable Spring Rolls are filled with tender mixed veggies in a Chinese style spit sauce that makes them the dude of all spring rolls! When fried and served steaming hot with tangy dips and sauce these crisp flavour-packed spring rolls, just rock!IngredientsSpring Roll Pastry, Refined Sunflower Oil, Iodised Salt, Onion, Capsicum, Carrot, Rice Noodles, Spring Onions, Green Chilli, Tomato Paste, Edible Vegetable Oil, Maida, and Mixed Spices.How to UseHeat Oil for deep frying, remove the product from the freezer and immerse it into the hot oil. Fry it for a few minutes on a low flame till they get a golden brown colour. Remove the rolls and soak up the excess oil.Storage InstructionsStore in a cool, dry and hygienic place.","Packaged Food > Snacks & Farsans"
dmart1708,"Mccain Emoti Bites",McCain,145,125,"Packaged Food","Snacks & Farsans","415 gm","
Note : This product is eligible for return ONLY at the time of delivery.

Once delivered, it cannot be returned.
","Packaged Food > Snacks & Farsans"
dmart1709,"ITC Master Chef Hara Bhara Kebab 210 gms","Master Chef",130,105,"Packaged Food","Snacks & Farsans","210 gm","
Go Green ! Enjoy this unique combination of veggies with authentic Indian spices. A nutritious & delicious classic vegetarian kebab made with spinach and green peas. Add taste & colour to your kebab platter. Slide this inside a sandwich, burger or a roll for a quick & nutritious treat. Just make it on tawa, no need to deep fry.
ITC Master Chef is a high quality brand and its products are of highest standard in taste & quality.

Note : This product is eligible for return ONLY at the time of delivery. Once delivered, it cannot be returned.
","Packaged Food > Snacks & Farsans"
dmart171,"Satyam Singdana (Groundnut)",Satyam,119,101,Grocery,"Masala & Spices","500 gm","OverviewSingdana or groundnuts are used extensively in many dishes across various cuisines. They have a high protein content and is rich in nutrients. Groundnuts are renowned worldwide for their health benefits. They are packed with Vitamin E, Magnesium, Folate, Copper and Arginine. You can add them to the food of your choice or can even be eaten plain as a snack.Key Features- Packed with proteins and nutrients","Grocery > Masala & Spices"
