p_id,Name,Brand,Price,DiscountedPrice,Category,SubCategory,Quantity,Description,BreadCrumbs
dmart120,"Satyam Udid (Urad) Whole",Satyam,106,98,Grocery,Pulses,"500 gm","OverviewSatyam Udid Whole is a staple to North Indian Cooking. It is rich in protein, essential minerals, various vitamins, fibre, and antioxidant compounds. It is used in the preparation of many traditional dishes. It is one of the richest sources of proteins and Vitamin B.","Grocery > Pulses"
dmart1200,"Paper Boat Chilli Guava","Paper Boat",35,25,"Dairy & Beverages",Beverages,"200 ml",India,"Dairy & Beverages > Beverages"
dmart1201,"Tropicana Orange Delight",Tropicana,115,97,"Dairy & Beverages",Beverages,"1 L","
Tropicana selects best fruits to manufacture high-quality juices and original products. It is committed to fostering healthy lifestyles by ensuring that its products are naturally nutritious and provide the daily benefits that one needs.

- Available in two categories - 100 percent juice and juice-based drinks
- Relish the goodness of oranges!
- Rich in natural nutrients that provide daily health benefits
- With no added preservative and no artificial colouring, this is the perfect fruit beverage to foster a healthy lifestyle
","Dairy & Beverages > Beverages"
dmart1202,"Tropicana Litchi Delight",Tropicana,110,90,"Dairy & Beverages",Beverages,"1 L","
Tropicana selects best fruits to manufacture high-quality juices and original products. It is committed to fostering healthy lifestyles by ensuring that its products are naturally nutritious and provide the daily benefits that one needs.

- Savour the superior taste of litchis
- Rich in natural nutrients that provide daily health benefits
- With no added preservative and no artificial colouring, this is the perfect fruit beverage to foster a healthy lifestyle
","Dairy & Beverages > Beverages"
dmart1203,"Paper Boat Alphonso Aam","Paper Boat",20,13,"Dairy & Beverages",Beverages,"150 ml","
*Actual packaging may vary from the Image

Note : Product in stock will be delivered basis availability
","Dairy & Beverages > Beverages"
dmart1204,"Amul Shrikhand Mango",Amul,105,97,"Dairy & Beverages",Dairy,"500 gm","About the ProductAmul Mango Srikhand is a semi-soft slightly sour sweetish milk dessert which is prepared with the help of lactic fermented curd. The flavour of the mango adds a refreshing touch and you can enjoy the dessert in its chilled version on a hot summer day. The soft and uniform texture of the mango Srikhand ensures that you have every bit of goodness of the whole milk with each spoonful.BenefitsAmul Mango Srikhand comes in small cups which can be served to guests directly. This dairy product is rich in essential proteins and calcium which help in bone health. This is a wholesome food; it helps to absorb calcium and Vitamin B and gives you a fuller feeling.","Dairy & Beverages > Dairy"
dmart1205,"Amul Shrikhand Elaichi",Amul,47,43,"Dairy & Beverages",Dairy,"200 gm","About the ProductA sweet creamy elaichi infused dessert, made in the authentic style with a distinct taste of cardamom. Makes for an ideal dessert for every occasion.IngredientsMilk Solids, Powdered Sugar, Cardamom.","Dairy & Beverages > Dairy"
dmart1206,"Amul Shrikhand Elaichi",Amul,105,97,"Dairy & Beverages",Dairy,"500 gm","About the Product- Shrikhand is a semi soft: sweetish sour: whole milk product prepared from lactic fermented curd. The curd (Dahi) is partially strained through a cloth to remove the whey and thus produce a solid mass called chakka (the basic ingredient for Shrikhand). This chakka is mixed with the required amount of sugar: etc.: to yield Shrikhand.- Prepared from fresh curds, cream, sugar and pasteurized which gives Amul Shrikhand smooth, tastier, richer and uniform in texture.- Loose Shrikhand, which is manufactured and marketed by Mithaiwalas / Halwai: who practically does not care for quality assurance and does not maintain hygienic standards; while - -- - Amul Shrikhand is made with the highest standard of quality and hygiene and is available at the most reasonable price.- Pasteurised before packing to ensure freedom from disease causing bacteria.- Hygienic: fully automated production process giving Shrikhand that is untouched by human hand.- Highest standard of quality and hygiene ensured at the most state of the art plant at Sugar Dairy: Baroda & Sabar Dairy: Himatnagar.- Amul Shrikhand is available in convenient to use cups as it is packed in four consumer pack-sizes.- Consumer has freedom to choose from four pack-sizes while on tour or on picnic or any time at home to serve the guests on special occasions.- Consistent quality provided with the assurance of Amul brand name.","Dairy & Beverages > Dairy"
dmart1207,"Paper Boat Jaljeera","Paper Boat",35,24,"Dairy & Beverages",Beverages,"200 ml",India,"Dairy & Beverages > Beverages"
dmart1208,"Chitale Full Cream Badam Pista Shrikhand",Chitale,145,127,"Dairy & Beverages",Dairy,"500 gm","Key Features- Badam pista flavour shrikhand- Made of natural ingredients- No added artificial flavours and coloursAbout The BrandChitale Dairy was founded by the great visionary, Late Shri Bhaskar Ganesh alias Babasaheb Chitale (B. G. Chitale). A journey that began in 1939, in the small town of Bhilawadi set the stage for a revolution in the country's dairy industry.Dairy farming has been the Group&rsquo;s forte and they have striven to elevate it to the level of a full-fledged industry. Research and development has always been the Group&rsquo;s primary focus. Having kept up with new technology &amp; scientific advances, the Group has achieved a distinct edge in the form of India&rsquo;s most modern and sophisticated buffalo farm, blood profile and frozen semen laboratory at their dairy farm in Bhilawadi, Maharashtra.","Dairy & Beverages > Dairy"
dmart1209,"Chitale Full Cream Badam Pista Shrikhand",Chitale,78,69,"Dairy & Beverages",Dairy,"250 gm","Key Features- Badam pista flavour shrikhand- Made of natural ingredients- No added artificial flavours and coloursAbout The BrandChitale Dairy was founded by the great visionary, Late Shri Bhaskar Ganesh alias Babasaheb Chitale (B. G. Chitale). A journey that began in 1939, in the small town of Bhilawadi set the stage for a revolution in the country's dairy industry.Dairy farming has been the Group&rsquo;s forte and they have striven to elevate it to the level of a full-fledged industry. Research and development has always been the Group&rsquo;s primary focus. Having kept up with new technology &amp; scientific advances, the Group has achieved a distinct edge in the form of India&rsquo;s most modern and sophisticated buffalo farm, blood profile and frozen semen laboratory at their dairy farm in Bhilawadi, Maharashtra.","Dairy & Beverages > Dairy"
dmart121,"Moong Whole",,73,60,Grocery,Pulses,"500 gm",India,"Grocery > Pulses"
dmart1210,"Raw Pressery Orange Juice","Raw Pressery",330,247,"Dairy & Beverages",Beverages,"1 L","Overview:Get a sunshine start to your day with perfectly squeezed Valencia oranges, with dietary fibres + vitamin C. Probably the best orange juice you have ever had!Key FeaturesSourced carefully and responsiblyBoosts immunitySkin protectionBenefitsThe pulp of oranges is where the fibre is. Fibre is great for digestion as it adds good roughage.Oranges are loaded with Vitamin C, an essential micronutrient for multiple functions of the body.RAW Pressery juices are not pasteurized at high temperatures and contain no chemicals, preservatives, artificial colours or added sugar.IngredientsVALENCIA ORANGE JUICE(91.8%), ORANGE PULP, CITRUS FIBER, VITAMIN C - ANTIOXIDANT (INS 300)Care InstructionsStore away from direct sunlight. Shake well before use.About the BrandRaw Pressery is a producer of juices and smoothies intended to offer nutritional and natural beverage alternatives. The company offers cold-press juices, smoothies, soups and nut milk made of organic ingredients, enabling customers to incorporate and benefit from healthy food and drinking habits.","Dairy & Beverages > Beverages"
dmart1211,"Amul Shrikhand Kesar",Amul,120,112,"Dairy & Beverages",Dairy,"500 gm","About the Product- Shrikhand is a semi soft: sweetish sour: whole milk product prepared from lactic fermented curd. The curd (Dahi) is partially strained through a cloth to remove the whey and thus produce a solid mass called chakka (the basic ingredient for Shrikhand). This chakka is mixed with the required amount of sugar: etc.: to yield Shrikhand.- Prepared from fresh curds, cream, sugar and pasteurized which gives Amul Shrikhand smooth, tastier, richer and uniform in texture.- Loose Shrikhand, which is manufactured and marketed by Mithaiwalas / Halwai: who practically does not care for quality assurance and does not maintain hygienic standards; while - -- - Amul Shrikhand is made with the highest standard of quality and hygiene and is available at the most reasonable price.- Pasteurised before packing to ensure freedom from disease causing bacteria.- Hygienic: fully automated production process giving Shrikhand that is untouched by human hand.- Highest standard of quality and hygiene ensured at the most state of the art plant at Sugar Dairy: Baroda & Sabar Dairy: Himatnagar.- Amul Shrikhand is available in convenient to use cups as it is packed in four consumer pack-sizes.- Consumer has freedom to choose from four pack-sizes while on tour or on picnic or any time at home to serve the guests on special occasions.- Consistent quality provided with the assurance of Amul brand name.","Dairy & Beverages > Dairy"
dmart1212,"Paper Boat Anar - 1 L","Paper Boat",150,75,"Dairy & Beverages",Beverages,"1 L","OverviewPomegranate, which is also known as Anar in India is packed with vitamins and nutrients. Originally from Iran, Anar today is one of the most favoured fruits to be had. Paperboat Anar Drink is packed with antioxidants, Vitamin C, Fibre, Proteins, and a whole lot of goodness. It comes in a versatile pouch that can be carried anywhere and consumed at any time. Enjoy the cool, refreshing taste of Anar with Paperboat Anar Drink.Key Features- Made from the juiciest pomegranates - No added preservatives - No GMO&rsquo;s - No preservatives - Gluten free - Packed with polyphenols and antioxidants - Good source of Vitamin C - Good for heart-healthIngredientswater, pomegranate juice concentrate (9.85%)*, pomegranate juice (6.85%)*, sugar, grape juice concentrate, iodised salt, spices, and condiments (ginger powder, pepper black powder), and black salt. *equivalent to 60 % pomegranate juice content.","Dairy & Beverages > Beverages"
dmart1213,"Chitale Full Cream Keshar Shrikhand",Chitale,78,71,"Dairy & Beverages",Dairy,"250 gm","OverviewChitale Dairy Full Cream Shrikhand is completed using complete milk hang curd, kesar and sugar. It has a sweet flavour with a soft sour after rich and taste, creamy texture. It can be served as a dessert or sweet dish.IngredientsChakka, sugar, nutmeg, saffron (keshar).About The BrandChitale Dairy was founded by the great visionary, Late Shri Bhaskar Ganesh alias Babasaheb Chitale (B. G. Chitale). A journey that began in 1939, in the small town of Bhilawadi set the stage for a revolution in the country's dairy industry.Dairy farming has been the Group&rsquo;s forte and they have striven to elevate it to the level of a full-fledged industry. Research and development has always been the Group&rsquo;s primary focus. Having kept up with new technology &amp; scientific advances, the Group has achieved a distinct edge in the form of India&rsquo;s most modern and sophisticated buffalo farm, blood profile and frozen semen laboratory at their dairy farm in Bhilawadi, Maharashtra.","Dairy & Beverages > Dairy"
dmart1214,"Chitale Full Cream Keshar Shrikhand",Chitale,145,134,"Dairy & Beverages",Dairy,"500 gm","OverviewChitale Dairy Full Cream Shrikhand is completed using complete milk hang curd, kesar and sugar. It has a sweet flavour with a soft sour after rich and taste, creamy texture. It can be served as a dessert or sweet dish.IngredientsChakka, sugar, nutmeg, saffron (keshar).About The BrandChitale Dairy was founded by the great visionary, Late Shri Bhaskar Ganesh alias Babasaheb Chitale (B. G. Chitale). A journey that began in 1939, in the small town of Bhilawadi set the stage for a revolution in the country's dairy industry.Dairy farming has been the Group&rsquo;s forte and they have striven to elevate it to the level of a full-fledged industry. Research and development has always been the Group&rsquo;s primary focus. Having kept up with new technology &amp; scientific advances, the Group has achieved a distinct edge in the form of India&rsquo;s most modern and sophisticated buffalo farm, blood profile and frozen semen laboratory at their dairy farm in Bhilawadi, Maharashtra.","Dairy & Beverages > Dairy"
dmart1215,"Baidyanath Amla Juice",Baidyanath,220,175,"Dairy & Beverages",Beverages,"1 L","OverviewBaidyanath Amla Juice has been extracted from Indian Gooseberry or Amla.BenefitsHELPS BOOST IMMUNITY: Baidyanath Amla Juice is made from the purest nutritionally rich and fresh amlas.NATURAL SOURCE OF VITAMIN C: Amla juice contains almost 20 times more Vitamin C content than fresh orange juice.HELPS WITH WEIGHT MANAGEMENT: Amla, the Indian gooseberry helps in keeping the digestive system on track.NATURAL GOODNESS OF AMLA: With all the goodness of nature, Baidyanath Amla Juice comes in a 1 litre bottle100 YEARS OF LEGACY AND PRIDE: We are a proud, Indian manufacturer of Ayurvedic products and we believe in uncompromised quality.IngredientsBaidyanath Amla Juice contains the purest form of Amla extracts which is turned into amla juice later.How To UseIdeally take 20-30 ml early morning on empty stomachCan be diluted with water.Any Other Must-Know InformationIndian gooseberry or Amla is undeniably a powerhouse of nutrients. One of the most effective ways to add Amla to your diet is to juice it and have it diluted with water every day on an empty stomach. Baidyanath Amla Juice is 100% pure, natural and free from any synthetic flavour and colour. It contains a whole set of vitamins and minerals that your body needs for wellbeing.About the BrandOne of Indias most respected Companies, Shree Baidyanath Ayurved Bhawan Pvt. Ltd. (Kolkata), popularly known as Baidyanath, is the acknowledged leader of Ayurvedic know-how. Established in 1917, the Company has played a pioneering role in re-establishing ancient knowledge with modern research and manufacturing techniques. ","Dairy & Beverages > Beverages"
dmart1216,"Raw Pressery Pomegranate Juice","Raw Pressery",425,318,"Dairy & Beverages",Beverages,"1 L","OverviewOur Pomegranate juice is a crowd favorite. Our Anaar has the sweet juice of the pulp without the bitterness of the seeds. Enjoy this healthy heart delight.Key Features- Sourced carefully & responsibly.- Vitamin C Fix.- Antioxidant Powerhouse.About The BrandRAW Pressery was born in Anuj&rsquo;s kitchen with a Norwalk cold-press juicer splattering carrots all over the ceiling. It all started with some simple questions &ndash; Why does being healthy have to be so complicated? After countless hours of juicing, weekends with farmers, and plenty of sleepless nights, Anuj and his team began production. You loved our juices so much, it spread into the vast juice-iverse! We grew to expand our retail and Direct-To-Home presence across Mumbai, Delhi, and Bengaluru. From just 8 juices we have now sprouted into 4 categories &ndash; Benefits, Basics, Boosters, and Soups with over 18 juices in our portfolio. Following Seqouia, Saama Capital, and DSG Consumer Partners all came aboard the juice express, helping us pave the way for future stops across India. We are all ready to serve you with a lot more in the days to come!","Dairy & Beverages > Beverages"
dmart1217,"Baidyanath Aloevera Juice",Baidyanath,250,200,"Dairy & Beverages",Beverages,"1 L","OverviewAloevera Juice revered for its health benefits in all ancients civilizations and modern science.Ayurveda recommends its usage in skin problems, hair fall and dandruff, liver disorders, digestive problems, joint pain, constipation, boost immunity and source of nutrition for complete body as its rich in vitamins, enzymes and micro-nutrients.Key FeaturesHelps to lower blood sugar levelsHelps build up a healthy digestive system.BenefitsCleanses and supports your digestive system.Infuses you with energy.Supports your immune system.Soothes and Promotes skin renewal.IngredientsAloe vera juiceHow To UseTake 30 ml of Aloe vera juice twice a day.Consume daily within 1 month after opening.Any Other Must-Know InformationBaidyanath aloe vera juice is a healthful combination of aloe vera pulp and juice. Baidyanath Aloe Vera juice helps to build a healthy digestive system and improves immunity to protect the body from severe sickness. Baidyanath Aloe Vera Juice with pulp condenses the magical benefits of this herb into a healthy, herbal and wholesome drink. It boosts immunity, builds a healthy digestive system and gives relief from constipation. Reduces fat and tones your body. It protects your liver. Alleviates skin allergies. Baidyanath Aloe Vera Juice is 100% pure, natural & free from any synthetic flavour & colour. It contains several vitamins and minerals that your body needs for its good nutrition.About the BrandOne of Indias most respected Companies, Shree Baidyanath Ayurved Bhawan Pvt. Ltd. (Kolkata), popularly known as Baidyanath, is the acknowledged leader of Ayurvedic know-how. Established in 1917, the Company has played a pioneering role in re-establishing ancient knowledge with modern research and manufacturing techniques. ","Dairy & Beverages > Beverages"
dmart1218,"Raw Pressery Sugarcane","Raw Pressery",220,165,"Dairy & Beverages",Beverages,"1 L","Overview:The original pressed juice. Bring back childhood with the Ganne ka Rass but without the Fuss (& worries about hygiene!) squeezed till the last juicy drop. With added tangy lemon, this one will hit home.Key FeaturesSourced carefully and responsiblyVitamin C fixIndia's first bottled ganne ka rassBenefitsRAW Pressery juices are not pasteurized at high temperatures and contain no chemicals, preservatives, artificial colours or added sugar.IngredientsSugarcane Juice (94%), Lemon JuiceCare InstructionsStore away from direct sunlight. Shake well before use.About the BrandRaw Pressery is a producer of juices and smoothies intended to offer nutritional and natural beverage alternatives. The company offers cold-press juices, smoothies, soups and nut milk made of organic ingredients, enabling customers to incorporate and benefit from healthy food and drinking habits.","Dairy & Beverages > Beverages"
dmart1219,"Baidyanath Karela Jamun Juice",Baidyanath,325,260,"Dairy & Beverages",Beverages,"1 L","Overview:Karela and Jamun are popular Ayurvedic herbs which help in maintaining the body functions normally. Baidyanath Karela Jamun Juice is 100% pure, natural & free from any synthetic flavour & colour. It contains several vitamins and minerals that your body needs for its well-being. Also helps in detoxifying the blood.BenefitsHELPS CONTROL SUGAR LEVELS: Karela and Jamun, both are great at keeping a check on blood sugar levels. Baidyanath Karela Jamun Juice is a combination of the purest form of Karela and Jamun, which together help in flushing out toxins from the intestinal tract and keeps common infections at bay. Baidyanath Karela Jamun Juice can help in increasing fluid and sodium retention, which in turn dramatically lowers the blood sugar levels.ACTIVE DIGESTIVE SYSTEM: Baidyanath Karela Jamun Juice is an excellent tonic to promote a healthy digestive system. It gets through your body and starts stimulating the liver to secrete digestive enzymes. This tonic can also help combat common stomach infections, constipation, diarrhoea and dysentery. It gradually cleanses the toxins from your body and maintains healthy bowel functions, so your body remains uninterrupted throughout the day.LOADED WITH VITAMINS AND NUTRIENTS: Karela is widely known as a health friendly vegetable with endless benefits if added to our regular diet. It's fully loaded with a range of powerful nutrients, like iron, Vitamin C, magnesium, potassium and more. Its a wonderful source of dietary fiber which contains almost twice the calcium of spinach. On the other hand, Jamun has an astringent property which flushes the toxins, keeps your skin free from acne and pimples and helps increase iron in your body.SOURCE OF ACTIVE BODY AND GOOD HEALTH: Baidyanath Karela Jamun Juice comes in a 1 litre pack and is a GMP certified product which is absolutely safe for adults. The product is vegan since it is plant based. We've made this juice using pure Karela and Jamun seeds which has all the essential nutrition. Consume 30ml of Baidyanath Karela Jamun juice twice a day before meals for effective results.100 YEARS OF LEGACY WITH INTENDED KNOWLEDGE: Baidyanath has been a renowned name in the world of Ayurveda. Our knowledge, legacy and research have made our medicinal products effective. Our strong network of herb growers resource only the potential and purest herbs from indigenous locations of the country. With 100 years of experience, we combine ancient Ayurveda with intended scientific research to bring out the best impactful remedy for your health.IngredientsKarela Jamun JuiceHow To UseTake 30 ml Baidyanath Karela Jamun Juice.Consume twice a day, before meal.Any Other Must-Know InformationLife style solutions from GOODCARE. Goodcare Karela Jamun Juice is 100% pure, natural & free from any synthetic flavour &colour. It contains many vitamins and minerals that your body needs for well being.About the BrandOne of Indias most respected Companies, Shree Baidyanath Ayurved Bhawan Pvt. Ltd. (Kolkata), popularly known as Baidyanath, is the acknowledged leader of Ayurvedic know-how. Established in 1917, the Company has played a pioneering role in re-establishing ancient knowledge with modern research and manufacturing techniques. ","Dairy & Beverages > Beverages"
dmart122,"Matki Small",,113,91,Grocery,Pulses,"500 gm","While we work to ensure that the product information is correct, actual product packaging and material may contain more or different information from what is given here. Please read the product labels, description, directions, warning and other information that comes with the actual product before use.","Grocery > Pulses"
dmart1220,"Baidyanath Giloy Juice",Baidyanath,250,170,"Dairy & Beverages",Beverages,"1 L","Key Featuresgiloy juice boosts immune system and body's resistance against infectionsregular consumption of tulsi giloy juice helps maintain a healthy heart and nervous systembaidyanath giloy tulsi juice is the powerhouse of many nutrients and vitaminsBrand: BaidyanathBenefitsBenefit of Giloy Juice Help to keep the smooth functioning of Liver.Help to overcome weakness after long illness.Suitable in the treatment of joints pain, weight management & tiredness.IngredientsGiloy JuiceHow To UseDOSAGE:15-20 ml twice, mixed with water after meals.Any Other Must-Know InformationGiloy, 'Amrita' the stem of immortality is recommended in Ayurveda as an immunity booster. It boost's the immune system and body's resistance against infections. Helpful in controlling skin allergies, joint pain, management of weight, protection from frequent cold & cough and convalescence from severe illness. Guduchi is traditionally known to tone up the liver function.About the BrandOne of Indias most respected Companies, Shree Baidyanath Ayurved Bhawan Pvt. Ltd. (Kolkata), popularly known as Baidyanath, is the acknowledged leader of Ayurvedic know-how. Established in 1917, the Company has played a pioneering role in re-establishing ancient knowledge with modern research and manufacturing techniques. ","Dairy & Beverages > Beverages"
dmart1221,"O'cean Pink Fruit Drink - Guava Flavour",OCean,50,25,"Dairy & Beverages",Beverages,"500 ml",India,"Dairy & Beverages > Beverages"
dmart1222,"Glucon-D Orange",Glucon-D,173,147,"Dairy & Beverages",Beverages,"450 gm","Overview:Glucon-D with the tangy orange flavour instantly energises you and fills you with immense energy to stay active all day long. With a healthy mix of vitamin-C, minerals, calcium and other essentials, this instant energy health drink charges you up, promotes mental alertness and helps you fight fatigue. This orange-flavoured drink can be had as a refreshing drink after a long and tiring day.Key FeaturesGlucon D fills you with the energy required to stay active. Kick away tiredness and feel rejuvenated with Glucon-D, the preferred choice in summer when the scorching heat drains out body glucose. Glucon D helps to provide instant energy. It contains Vitamin C which improves the mental alertness that helps you to concentrate better while doing various daily tasks.How to UseAdd 4 teaspoon of Glucon-D (approx. 35 gms) to 1 glass of water (200ml) and stir. Recommended 2 glasses per day.Care InstructionsAfter Opening transfer contents into an air-tight jar. Store in a cool, dry place, away from strong odours.About the BrandLaunched in 1933, it boasts of a rich heritage of over 85 years. Millions of Indian households have trusted Glucon-D to get Instant Energy when they get tired.","Dairy & Beverages > Beverages"
